<?xml version="1.0" encoding="UTF-8"?>
<xs:schema xmlns:xs="http://www.w3.org/2001/XMLSchema">
    <xs:element name="tabla_periodica">
        <xs:complexType>
            <xs:sequence>
                <xs:element name="elemento" minOccurs="1" maxOccurs="unbounded">
                    <xs:complexType>
                        <xs:sequence>
                            <xs:element name="nombre" type="xs:string" />
                            <xs:element name="simbolo">
                                <xs:simpleType>
                                    <xs:restriction base="xs:string">
                                        <xs:pattern value="[A-Z][a-z]{0,2}" />
                                    </xs:restriction>
                                </xs:simpleType>
                            </xs:element>
                            <xs:element name="numero_atomico" type="xs:integer" />
                            <xs:element name="punto_ebullicion">
                                <xs:complexType>
                                    <xs:simpleContent>
                                        <xs:extension base="xs:integer">
                                            <xs:attribute name="unidades" type="xs:string"
                                                default="centigrados" />
                                        </xs:extension>
                                    </xs:simpleContent>
                                </xs:complexType>
                            </xs:element>
                            <xs:element name="densidad">
                                <xs:complexType>
                                    <xs:simpleContent>
                                        <xs:extension base="xs:decimal">
                                            <xs:attribute name="unidades" type="xs:string" />
                                        </xs:extension>
                                    </xs:simpleContent>
                                </xs:complexType>
                            </xs:element>
                        </xs:sequence>
                        <xs:attribute name="estado" type="xs:string" />
                        <xs:attribute name="grupo" type="xs:integer" />
                    </xs:complexType>
                </xs:element>
                <xs:element name="grupo" minOccurs="0" maxOccurs="unbounded">
                    <xs:complexType>
                        <xs:sequence>
                            <xs:element name="nombre" type="xs:string" />
                            <xs:element name="descripcion" type="xs:string" />
                        </xs:sequence>
                        <xs:attribute name="numero" type="xs:integer" />
                    </xs:complexType>
                </xs:element>
            </xs:sequence>
        </xs:complexType>
    </xs:element>

</xs:schema>