<?xml version="1.0" encoding="UTF-8"?>
<tabla_periodica xmlns:xsi="http://www.w3.org/2001/XMLSchema-instance" xsi:noNamespaceSchemaLocation="UD4_T6B_EloyRodalPerez.xsd">
    <elemento estado="gas" grupo="1">
        <nombre>Litio</nombre>
        <simbolo>Li</simbolo>
        <numero_atomico>3</numero_atomico>
        <punto_ebullicion unidades="kelvin">1615</punto_ebullicion>
        <densidad unidades="gramos/centímetros cúbicos">0.534</densidad>
    </elemento>
    <elemento estado="sólido" grupo="1">
        <nombre>Sodio</nombre>
        <simbolo>Na</simbolo>
        <numero_atomico>11</numero_atomico>
        <punto_ebullicion unidades="kelvin">1156</punto_ebullicion>
        <densidad unidades="gramos/centímetros cúbicos">0.971</densidad>
    </elemento>
    <grupo numero="1">
        <nombre>Metales alcalinos</nombre>
        <descripcion>Son metales blandos, muy reactivos y tienen solo un electrón en la capa de
            valencia.</descripcion>
    </grupo>
    <grupo numero="18">
        <nombre>Gases nobles</nombre>
        <descripcion>Son gases incoloros, inodoros e insípidos y tienen una baja reactividad química.</descripcion>
    </grupo>
</tabla_periodica>